Id	Code	Name	Standard Class	Domain	Vocab	Validity	Concept
44829487	999.0	Generalized vaccinia as a complication of medical care, not elsewhere classified	4-dig billing code	Condition	ICD9CM	Valid	Non-standard
44829518	E850.4	Accidental poisoning by aromatic analgesics, not elsewhere classified	4-dig billing E code	Condition	ICD9CM	Valid	Non-standard
44829525	E864.0	Accidental poisoning by corrosive aromatics not elsewhere classified	4-dig billing E code	Condition	ICD9CM	Valid	Non-standard
44829735	041.0	Streptococcus infection in conditions classified elsewhere and of unspecified site	4-dig nonbill code	Condition	ICD9CM	Valid	Non-standard
44829760	079.0	Adenovirus infection in conditions classified elsewhere and of unspecified site	4-dig billing code	Condition	ICD9CM	Valid	Non-standard
44829907	281.3	Other specified megaloblastic anemias not elsewhere classified	4-dig billing code	Condition	ICD9CM	Valid	Non-standard
44829917	294.10	Dementia in conditions classified elsewhere without behavioral disturbance	5-dig billing code	Condition	ICD9CM	Valid	Non-standard
44829949	312.8	Other specified disturbances of conduct, not elsewhere classified	4-dig nonbill code	Condition	ICD9CM	Valid	Non-standard
44829965	341.21	Acute (transverse) myelitis in conditions classified elsewhere	5-dig billing code	Condition	ICD9CM	Valid	Non-standard
44829975	346.2	Variants of migraine, not elsewhere classified	4-dig nonbill code	Condition	ICD9CM	Valid	Non-standard
44829976	346.20	Variants of migraine, not elsewhere classified, without mention of intractable migraine without mention of status migrainosus	5-dig billing code	Condition	ICD9CM	Valid	Non-standard
44829989	357.4	Polyneuropathy in other diseases classified elsewhere	4-dig billing code	Condition	ICD9CM	Valid	Non-standard
44830171	580.81	Acute glomerulonephritis in diseases classified elsewhere	5-dig billing code	Condition	ICD9CM	Valid	Non-standard
44830177	596.2	Vesical fistula, not elsewhere classified	4-dig billing code	Condition	ICD9CM	Valid	Non-standard
44830339	718.86	Other joint derangement, not elsewhere classified, lower leg	5-dig billing code	Condition	ICD9CM	Valid	Non-standard
44830430	774.31	Neonatal jaundice due to delayed conjugation in diseases classified elsewhere	5-dig billing code	Condition	ICD9CM	Valid	Non-standard
44830637	997.91	Complications affecting other specified body systems, not elsewhere classified, hypertension	5-dig billing code	Condition	ICD9CM	Valid	Non-standard
44830920	041.10	Staphylococcus infection in conditions classified elsewhere and of unspecified site, staphylococcus, unspecified	5-dig billing code	Condition	ICD9CM	Valid	Non-standard
44831053	259.0	Delay in sexual development and puberty, not elsewhere classified	4-dig billing code	Condition	ICD9CM	Valid	Non-standard
44831123	334.4	Cerebellar ataxia in diseases classified elsewhere	4-dig billing code	Condition	ICD9CM	Valid	Non-standard
44831125	336.2	Subacute combined degeneration of spinal cord in diseases classified elsewhere	4-dig billing code	Condition	ICD9CM	Valid	Non-standard
44831126	336.3	Myelopathy in other diseases classified elsewhere	4-dig billing code	Condition	ICD9CM	Valid	Non-standard
44831133	348.3	Encephalopathy, not elsewhere classified	4-dig nonbill code	Condition	ICD9CM	Valid	Non-standard
44831142	359.6	Symptomatic inflammatory myopathy in diseases classified elsewhere	4-dig billing code	Condition	ICD9CM	Valid	Non-standard
44831243	421.1	Acute and subacute infective endocarditis in diseases classified elsewhere	4-dig billing code	Condition	ICD9CM	Valid	Non-standard
44831317	567.0	Peritonitis in infectious diseases classified elsewhere	4-dig billing code	Condition	ICD9CM	Valid	Non-standard
44831319	573.2	Hepatitis in other infectious diseases classified elsewhere	4-dig billing code	Condition	ICD9CM	Valid	Non-standard
44831349	621	Disorders of uterus, not elsewhere classified	3-dig nonbill code	Condition	ICD9CM	Valid	Non-standard
44831770	974.6	Poisoning by other mineral salts, not elsewhere classified	4-dig billing code	Condition	ICD9CM	Valid	Non-standard
44831776	977.2	Poisoning by antidotes and chelating agents, not elsewhere classified	4-dig billing code	Condition	ICD9CM	Valid	Non-standard
44831784	995.1	Angioneurotic edema, not elsewhere classified	4-dig billing code	Condition	ICD9CM	Valid	Non-standard
44831795	996.59	Mechanical complication due to other implant and internal device, not elsewhere classified	5-dig billing code	Condition	ICD9CM	Valid	Non-standard
44832091	079.3	Rhinovirus infection in conditions classified elsewhere and of unspecified site	4-dig billing code	Condition	ICD9CM	Valid	Non-standard
44832205	276.9	Electrolyte and fluid disorders not elsewhere classified	4-dig billing code	Condition	ICD9CM	Valid	Non-standard
44832222	293.83	Mood disorder in conditions classified elsewhere	5-dig billing code	Condition	ICD9CM	Valid	Non-standard
44832260	327.01	Insomnia due to medical condition classified elsewhere	5-dig billing code	Condition	ICD9CM	Valid	Non-standard
44832294	359.5	Myopathy in endocrine diseases classified elsewhere	4-dig billing code	Condition	ICD9CM	Valid	Non-standard
44832407	456.20	Esophageal varices in diseases classified elsewhere, with bleeding	5-dig billing code	Condition	ICD9CM	Valid	Non-standard
44832432	520.5	Hereditary disturbances in tooth structure, not elsewhere classified	4-dig billing code	Condition	ICD9CM	Valid	Non-standard
44832488	595.4	Cystitis in diseases classified elsewhere	4-dig billing code	Condition	ICD9CM	Valid	Non-standard
44832556	655.80	Other known or suspected fetal abnormality, not elsewhere classified, affecting management of mother, unspecified as to episode of care or not applicable	5-dig billing code	Condition	ICD9CM	Valid	Non-standard
44832644	718.8	Other joint derangement, not elsewhere classified	4-dig nonbill code	Condition	ICD9CM	Valid	Non-standard
44832645	718.83	Other joint derangement, not elsewhere classified, forearm	5-dig billing code	Condition	ICD9CM	Valid	Non-standard
44832652	719.57	Stiffness of joint, not elsewhere classified, ankle and foot	5-dig billing code	Condition	ICD9CM	Valid	Non-standard
44832655	720.81	Inflammatory spondylopathies in diseases classified elsewhere	5-dig billing code	Condition	ICD9CM	Valid	Non-standard
44832680	746.84	Obstructive anomalies of heart, not elsewhere classified	5-dig billing code	Condition	ICD9CM	Valid	Non-standard
44832918	989.4	Toxic effect of other pesticides, not elsewhere classified	4-dig billing code	Condition	ICD9CM	Valid	Non-standard
44832920	989.89	Toxic effect of other substance, chiefly nonmedicinal as to source, not elsewhere classified	5-dig billing code	Condition	ICD9CM	Valid	Non-standard
44832933	999	Complications of medical care, not elsewhere classified	3-dig nonbill code	Condition	ICD9CM	Valid	Non-standard
44832934	999.3	Other infection due to medical care, not elsewhere classified	4-dig nonbill code	Condition	ICD9CM	Valid	Non-standard
44832935	999.5	Other serum reaction, not elsewhere classified	4-dig nonbill code	Condition	ICD9CM	Valid	Non-standard
44832982	E864.2	Accidental poisoning by caustic alkalis not elsewhere classified	4-dig billing E code	Condition	ICD9CM	Valid	Non-standard
44833226	041.01	Streptococcus infection in conditions classified elsewhere and of unspecified site, streptococcus, group A	5-dig billing code	Condition	ICD9CM	Valid	Non-standard
44833228	041.9	Bacterial infection, unspecified, in conditions classified elsewhere and of unspecified site	4-dig billing code	Condition	ICD9CM	Valid	Non-standard
44833398	293.0	Delirium due to conditions classified elsewhere	4-dig billing code	Condition	ICD9CM	Valid	Non-standard
44833421	311	Depressive disorder, not elsewhere classified	3-dig billing code	Condition	ICD9CM	Valid	Non-standard
44833432	330.3	Cerebral degeneration of childhood in other diseases classified elsewhere	4-dig billing code	Condition	ICD9CM	Valid	Non-standard
44833455	358.1	Myasthenic syndromes in diseases classified elsewhere	4-dig billing code	Condition	ICD9CM	Valid	Non-standard
44833538	382.02	Acute suppurative otitis media in diseases classified elsewhere	5-dig billing code	Condition	ICD9CM	Valid	Non-standard
44833610	484	Pneumonia in infectious diseases classified elsewhere	3-dig nonbill code	Condition	ICD9CM	Valid	Non-standard
44833648	564	Functional digestive disorders, not elsewhere classified	3-dig nonbill code	Condition	ICD9CM	Valid	Non-standard
44833675	604.91	Orchitis and epididymitis in diseases classified elsewhere	5-dig billing code	Condition	ICD9CM	Valid	Non-standard
44833677	608.81	Disorders of male genital organs in diseases classified elsewhere	5-dig billing code	Condition	ICD9CM	Valid	Non-standard
44833757	659	Other indications for care or intervention related to labor and delivery, not elsewhere classified	3-dig nonbill code	Condition	ICD9CM	Valid	Non-standard
44833830	718.81	Other joint derangement, not elsewhere classified, shoulder region	5-dig billing code	Condition	ICD9CM	Valid	Non-standard
44833836	719.5	Stiffness of joint, not elsewhere classified	4-dig nonbill code	Condition	ICD9CM	Valid	Non-standard
44833864	730.88	Other infections involving bone in diseases classified elsewhere, other specified sites	5-dig billing code	Condition	ICD9CM	Valid	Non-standard
44833871	739	Nonallopathic lesions, not elsewhere classified	3-dig nonbill code	Condition	ICD9CM	Valid	Non-standard
44833889	755.22	Longitudinal deficiency of upper limb, not elsewhere classified	5-dig billing code	Condition	ICD9CM	Valid	Non-standard
44834125	998.89	Other specified complications of procedures not elsewhere classified	5-dig billing code	Condition	ICD9CM	Valid	Non-standard
44834271	V40.31	Wandering in diseases classified elsewhere	5-dig billing V code	Condition	ICD9CM	Valid	Non-standard
44834423	041.05	Streptococcus infection in conditions classified elsewhere and of unspecified site, streptococcus, group G	5-dig billing code	Condition	ICD9CM	Valid	Non-standard
44834424	041.81	Other specified bacterial infections in conditions classified elsewhere and of unspecified site, mycoplasma	5-dig billing code	Condition	ICD9CM	Valid	Non-standard
44834425	041.83	Other specified bacterial infections in conditions classified elsewhere and of unspecified site, Clostridium perfringens	5-dig billing code	Condition	ICD9CM	Valid	Non-standard
44834441	079.4	Human papillomavirus in conditions classified elsewhere and of unspecified site	4-dig billing code	Condition	ICD9CM	Valid	Non-standard
44834442	079.8	Other specified viral and chlamydial infections in conditions classified elsewhere and of unspecified site	4-dig nonbill code	Condition	ICD9CM	Valid	Non-standard
44834444	079.9	Unspecified viral and chlamydial infection in conditions classified elsewhere and of unspecified site	4-dig nonbill code	Condition	ICD9CM	Valid	Non-standard
44834556	259.1	Precocious sexual development and puberty, not elsewhere classified	4-dig billing code	Condition	ICD9CM	Valid	Non-standard
44834557	259.4	Dwarfism, not elsewhere classified	4-dig billing code	Condition	ICD9CM	Valid	Non-standard
44834571	279.4	Autoimmune disease, not elsewhere classified	4-dig nonbill code	Condition	ICD9CM	Valid	Non-standard
44834584	293.9	Unspecified transient mental disorder in conditions classified elsewhere	4-dig billing code	Condition	ICD9CM	Valid	Non-standard
44834585	294.9	Unspecified persistent mental disorders due to conditions classified elsewhere	4-dig billing code	Condition	ICD9CM	Valid	Non-standard
44834613	312.3	Disorders of impulse control, not elsewhere classified	4-dig nonbill code	Condition	ICD9CM	Valid	Non-standard
44834620	323.42	Other myelitis due to other infections classified elsewhere	5-dig billing code	Condition	ICD9CM	Valid	Non-standard
44834625	327.14	Hypersomnia due to medical condition classified elsewhere	5-dig billing code	Condition	ICD9CM	Valid	Non-standard
44834637	346.22	Variants of migraine, not elsewhere classified, without mention of intractable migraine with status migrainosus	5-dig billing code	Condition	ICD9CM	Valid	Non-standard
44834733	429.7	Certain sequelae of myocardial infarction, not elsewhere classified	4-dig nonbill code	Condition	ICD9CM	Valid	Non-standard
44834911	655.8	Other known or suspected fetal abnormality, not elsewhere classified, affecting management of mother	4-dig nonbill code	Condition	ICD9CM	Valid	Non-standard
44834972	713	Arthropathy associated with other disorders classified elsewhere	3-dig nonbill code	Condition	ICD9CM	Valid	Non-standard
44834999	719.54	Stiffness of joint, not elsewhere classified, hand	5-dig billing code	Condition	ICD9CM	Valid	Non-standard
44835000	719.55	Stiffness of joint, not elsewhere classified, pelvic region and thigh	5-dig billing code	Condition	ICD9CM	Valid	Non-standard
44835010	727.01	Synovitis and tenosynovitis in diseases classified elsewhere	5-dig billing code	Condition	ICD9CM	Valid	Non-standard
44835020	731	Osteitis deformans and osteopathies associated with other disorders classified elsewhere	3-dig nonbill code	Condition	ICD9CM	Valid	Non-standard
44835293	996.52	Mechanical complication due to graft of other tissue, not elsewhere classified	5-dig billing code	Condition	ICD9CM	Valid	Non-standard
44835301	997.9	Complications affecting other specified body systems, not elsewhere classified	4-dig nonbill code	Condition	ICD9CM	Valid	Non-standard
44835342	E864	Accidental poisoning by corrosives and caustics, not elsewhere classified	3-dig nonbill E code	Condition	ICD9CM	Valid	Non-standard
44835343	E864.3	Accidental poisoning by other specified corrosives and caustics not elsewhere classified	4-dig billing E code	Condition	ICD9CM	Valid	Non-standard
44835610	041.19	Staphylococcus infection in conditions classified elsewhere and of unspecified site, other staphylococcus	5-dig billing code	Condition	ICD9CM	Valid	Non-standard
44835611	041.6	Proteus (mirabilis) (morganii) infection in conditions classified elsewhere and of unspecified site	4-dig billing code	Condition	ICD9CM	Valid	Non-standard
44835776	293.8	Other specified transient mental disorders due to conditions classified elsewhere	4-dig nonbill code	Condition	ICD9CM	Valid	Non-standard
44835777	293.81	Psychotic disorder with delusions in conditions classified elsewhere	5-dig billing code	Condition	ICD9CM	Valid	Non-standard
44835778	294	Persistent mental disorders due to conditions classified elsewhere	3-dig nonbill code	Condition	ICD9CM	Valid	Non-standard
44835813	312	Disturbance of conduct, not elsewhere classified	3-dig nonbill code	Condition	ICD9CM	Valid	Non-standard
44835819	323.2	Encephalitis, myelitis, and encephalomyelitis in protozoal diseases classified elsewhere	4-dig billing code	Condition	ICD9CM	Valid	Non-standard
44835843	346.21	Variants of migraine, not elsewhere classified, with intractable migraine, so stated, without mention of status migrainosus	5-dig billing code	Condition	ICD9CM	Valid	Non-standard
44835976	478.79	Other diseases of larynx, not elsewhere classified	5-dig billing code	Condition	ICD9CM	Valid	Non-standard
44835990	517	Lung involvement in conditions classified elsewhere	3-dig nonbill code	Condition	ICD9CM	Valid	Non-standard
44836040	598.01	Urethral stricture due to infective diseases classified elsewhere	5-dig billing code	Condition	ICD9CM	Valid	Non-standard
44836045	601.4	Prostatitis in diseases classified elsewhere	4-dig billing code	Condition	ICD9CM	Valid	Non-standard
44836192	719.52	Stiffness of joint, not elsewhere classified, upper arm	5-dig billing code	Condition	ICD9CM	Valid	Non-standard
44836489	997.0	Central nervous system complications, not elsewhere classified	4-dig nonbill code	Condition	ICD9CM	Valid	Non-standard
44836527	E862	Accidental poisoning by petroleum products, other solvents and their vapors, not elsewhere classified	3-dig nonbill E code	Condition	ICD9CM	Valid	Non-standard
44836770	041.2	Pneumococcus infection in conditions classified elsewhere and of unspecified site	4-dig billing code	Condition	ICD9CM	Valid	Non-standard
44836771	041.3	Friedlnder's bacillus infection in conditions classified elsewhere and of unspecified site	4-dig billing code	Condition	ICD9CM	Valid	Non-standard
44836773	041.5	Hemophilus influenzae [H. influenzae] infection in conditions classified elsewhere and of unspecified site	4-dig billing code	Condition	ICD9CM	Valid	Non-standard
44836939	279.49	Autoimmune disease, not elsewhere classified	5-dig billing code	Condition	ICD9CM	Valid	Non-standard
44836991	310.1	Personality change due to conditions classified elsewhere	4-dig billing code	Condition	ICD9CM	Valid	Non-standard
44836995	321.2	Meningitis due to viruses not elsewhere classified	4-dig billing code	Condition	ICD9CM	Valid	Non-standard
44837018	353.3	Thoracic root lesions, not elsewhere classified	4-dig billing code	Condition	ICD9CM	Valid	Non-standard
44837102	420.0	Acute pericarditis in diseases classified elsewhere	4-dig billing code	Condition	ICD9CM	Valid	Non-standard
44837104	424.91	Endocarditis in diseases classified elsewhere	5-dig billing code	Condition	ICD9CM	Valid	Non-standard
44837187	582.81	Chronic glomerulonephritis in diseases classified elsewhere	5-dig billing code	Condition	ICD9CM	Valid	Non-standard
44837346	718.80	Other joint derangement, not elsewhere classified, site unspecified	5-dig billing code	Condition	ICD9CM	Valid	Non-standard
44837351	719.51	Stiffness of joint, not elsewhere classified, shoulder region	5-dig billing code	Condition	ICD9CM	Valid	Non-standard
44837424	780.61	Fever presenting with conditions classified elsewhere	5-dig billing code	Condition	ICD9CM	Valid	Non-standard
44837635	997.3	Respiratory complications, not elsewhere classified	4-dig nonbill code	Condition	ICD9CM	Valid	Non-standard
44837673	E852.5	Accidental poisoning by mixed sedatives, not elsewhere classified	4-dig billing E code	Condition	ICD9CM	Valid	Non-standard
45420246	F007.00	Meningitis in other bacterial disease classified elsewhere	Read	Condition	Read	Valid	Non-standard
45420277	F2X..00	Vascular headache, not elsewhere classified	Read	Condition	Read	Valid	Non-standard
45420338	FyuB400	[X]Parasitic infestation of eyelid in diseases classified elsewhere	Read	Condition	Read	Valid	Non-standard
45420340	FyuC700	[X]Other disorders of conjunctiva in diseases classified elsewhere	Read	Condition	Read	Valid	Non-standard
45420343	FyuDG00	[X]Iridocyclitis in infectious and parasitic diseases classified elsewhere	Read	Condition	Read	Valid	Non-standard
45420344	FyuE500	[X]Other disorders of lens in diseases classified elsewhere	Read	Condition	Read	Valid	Non-standard
45420388	Gyu5E00	[X]Endocarditis, valve unspecified, in diseases classified elsewhere	Read	Condition	Read	Valid	Non-standard
45420389	Gyu5J00	[X]Myocarditis in viral diseases classified elsewhere	Read	Condition	Read	Valid	Non-standard
45420391	Gyu6900	[X]Cerebral arteritis in other diseases classified elsewhere	Read	Condition	Read	Valid	Non-standard
45420534	Kyu0400	[X]Glomerular disorders in other endocrine, nutritional and metabolic diseases classified elsewhere	Read	Condition	Read	Valid	Non-standard
45420864	Ryu7300	[X]Haemorrhage, not elsewhere classified	Read	Condition	Read	Valid	Non-standard
45420865	Ryu8000	[X]Other abnormalities of white blood cells, not elsewhere classified	Read	Condition	Read	Valid	Non-standard
45423164	A7y0100	Retrovirus as the cause of diseases classified to other chapters	Read	Condition	Read	Valid	Non-standard
45423165	A7y0200	Respiratory syncytial virus as the cause of diseases classified to other chapters	Read	Condition	Read	Valid	Non-standard
45423192	AyuCA00	[X]Hiv disease resulting in multiple diseases classified elsewhere	Read	Condition	Read	Valid	Non-standard
45423200	AyuKM00	[X]Retrovirus as the cause of diseases classified to other chapters	Read	Condition	Read	Valid	Non-standard
45423510	Fyu5A00	[X]Vascular headache, not elsewhere classified	Read	Condition	Read	Valid	Non-standard
45423511	Fyu7400	[X]Polyneuropathy in neoplastic disease classified elsewhere	Read	Condition	Read	Valid	Non-standard
45423512	Fyu7600	[X]Polyneuropathy in nutritional deficiency classified elsewhere	Read	Condition	Read	Valid	Non-standard
45423513	Fyu7900	[X]Polyneuropathy in other diseases classified elsewhere	Read	Condition	Read	Valid	Non-standard
45423515	FyuAC00	[X]Autonomic neuropathy in endocrine and metabolic diseases classified elsewhere	Read	Condition	Read	Valid	Non-standard
45423517	FyuN400	[X]Otitis externa in viral diseases classified elsewhere	Read	Condition	Read	Valid	Non-standard
45423551	Gyu5T00	[X]Cardiomyopathy in other diseases classified elsewhere	Read	Condition	Read	Valid	Non-standard
45423692	Kyu0500	[X]Glomerular disorders in systemic disorders of connective tissue classified elsewhere	Read	Condition	Read	Valid	Non-standard
45423696	Kyu6900	[X]Disorders of testis and epididymis in diseases classified elsewhere	Read	Condition	Read	Valid	Non-standard
45423903	Nyu4800	[X]Dermato(poly)myositis in neoplastic disease classified elsewhere	Read	Condition	Read	Valid	Non-standard
45426388	A3Bx.00	Bacteria causing diseases classified elsewhere	Read	Condition	Read	Valid	Non-standard
45426603	Cyu4L00	[X]Disorders of other endocrine glands in diseases classified elsewhere	Read	Condition	Read	Valid	Non-standard
45426693	F03X.00	Bacterial meningoencephalitis and meningomyelitis, not elsewhere classified	Read	Condition	Read	Valid	Non-standard
45426785	Fyu3400	[X]Other specified degenerative disorders of the nervous system in diseases classified elsewhere	Read	Condition	Read	Valid	Non-standard
45426787	Fyu7700	[X]Polyneuropathy in systemic connective tissue disorders classified elsewhere	Read	Condition	Read	Valid	Non-standard
45426788	Fyu8A00	[X]Mitochondrial myopathy, not elsewhere classified	Read	Condition	Read	Valid	Non-standard
45426834	Gyu5d00	[X]Other heart disorders in other infectious and parasitic diseases classified elsewhere	Read	Condition	Read	Valid	Non-standard
45427150	Nyu1600	[X]Juvenile arthritis in other diseases classified elsewhere	Read	Condition	Read	Valid	Non-standard
45427151	Nyu3B00	[X]Other specific joint derangements, not elsewhere classified	Read	Condition	Read	Valid	Non-standard
45427154	Nyu6800	[X]Spondylopathy in other diseases classified elsewhere	Read	Condition	Read	Valid	Non-standard
45427160	NyuCD00	[X]Osteitis deformans in neoplastic diseases classified elsewhere	Read	Condition	Read	Valid	Non-standard
45429751	AyuKK00	[X]Enterovirus as the cause of diseases classified to other chapters	Read	Condition	Read	Valid	Non-standard
45429752	AyuKQ00	[X]Parvovirus as the cause of diseases classified to other chapters	Read	Condition	Read	Valid	Non-standard
45429955	Cyu4J00	[X]Disorders of thyroid gland in diseases classified elsewhere	Read	Condition	Read	Valid	Non-standard
45429971	Dyu0400	[X]Other megaloblastic anaemias, not elsewhere classified	Read	Condition	Read	Valid	Non-standard
45430124	FyuD900	[X]Keratitis and keratoconjunctivitis in other infectious and parasitic diseases classified elsewhere	Read	Condition	Read	Valid	Non-standard
45430127	FyuP500	[X]Otitis media in other diseases classified elsewhere	Read	Condition	Read	Valid	Non-standard
45430262	Jyu5700	[X]Neurogenic bowel, not elsewhere classified	Read	Condition	Read	Valid	Non-standard
45430522	Nyu1A00	[X]Other specific arthropathies, not elsewhere classified	Read	Condition	Read	Valid	Non-standard
45430917	SyuFT00	[X]Poisoning by other antihypertensive drugs, not elsewhere classified	Read	Condition	Read	Valid	Non-standard
45433075	AyuK300	[X]Streptococcus pneumoniae as the cause of diseases classified to other chapters	Read	Condition	Read	Valid	Non-standard
45433296	Eu53y00	[X]Other mental and behavioural disorders associated with the puerperium, not elsewhere classified	Read	Condition	Read	Valid	Non-standard
45433397	Fyu0500	[X]Bacterial meningoencephalitis and meningomyelitis, not elsewhere classified	Read	Condition	Read	Valid	Non-standard
45433399	Fyu1600	[X]Systemic atrophy affecting the central nervous system in other diseases classified elsewhere	Read	Condition	Read	Valid	Non-standard
45433401	Fyu6600	[X]Nerve root and plexus compressions in neoplastic disease classified elsewhere	Read	Condition	Read	Valid	Non-standard
45433404	FyuM200	[X]Visual disturbances in diseases classified elsewhere	Read	Condition	Read	Valid	Non-standard
45433566	K0B0.00	Renal tubulo-interstitial disorders in infectious and parasitic diseases classified elsewhere	Read	Condition	Read	Valid	Non-standard
45433609	Kyu0200	[X]Glomerular disorders in blood diseases and disorders involving the immune mechanism classified elsewhere	Read	Condition	Read	Valid	Non-standard
45433613	Kyu4200	[X]Other disorders of kidney and ureter in infectious and parasitic diseases classified elsewhere	Read	Condition	Read	Valid	Non-standard
45433614	Kyu8400	[X]Ulceration of vulva in infectious and parasitic diseases classified elsewhere	Read	Condition	Read	Valid	Non-standard
45433615	Kyu8500	[X]Vaginitis, vulvitis and vulvovaginitis in infectious and parasitic disease classified elsewhere	Read	Condition	Read	Valid	Non-standard
45433976	Ryu8900	[X]Abnormality of white blood cells, not elsewhere classified	Read	Condition	Read	Valid	Non-standard
45434243	SyuGH00	[X]Toxic effect of paints and dyes, not elsewhere classified	Read	Condition	Read	Valid	Non-standard
45434568	U629z00	[X]Orthopaedic devices associated with adverse incidents, miscellaneous devices, not elsewhere classified	Read	Condition	Read	Valid	Non-standard
45436342	A3BXB00	Klebsiella pneumoniae as the cause of diseases classified to other chapters	Read	Condition	Read	Valid	Non-standard
45436586	Dyu2200	[X]Anaemia in other chronic diseases classified elsewhere	Read	Condition	Read	Valid	Non-standard
45436721	Fyu2800	[X]Extrapyramidal and movement disorders in diseases classified elsewhere	Read	Condition	Read	Valid	Non-standard
45436722	Fyu8700	[X]Myopathy in endocrine diseases classified elsewhere	Read	Condition	Read	Valid	Non-standard
