Id	Code	Name	Standard Class	Domain	Vocab	Validity	Concept
35207548	H28	Cataract in diseases classified elsewhere	3-char billing code	Condition	ICD10CM	Valid	Non-standard
35207551	H32	Chorioretinal disorders in diseases classified elsewhere	3-char billing code	Condition	ICD10CM	Valid	Non-standard
35207555	H36	Retinal disorders in diseases classified elsewhere	3-char nonbill code	Condition	ICD10CM	Valid	Non-standard
35207558	H42	Glaucoma in diseases classified elsewhere	3-char billing code	Condition	ICD10CM	Valid	Non-standard
35207591	H67.1	Otitis media in diseases classified elsewhere, right ear	4-char billing code	Condition	ICD10CM	Valid	Non-standard
35207622	H91.3	Deaf nonspeaking, not elsewhere classified	4-char billing code	Condition	ICD10CM	Valid	Non-standard
35207721	I31.2	Hemopericardium, not elsewhere classified	4-char billing code	Condition	ICD10CM	Valid	Non-standard
35207725	I32	Pericarditis in diseases classified elsewhere	3-char billing code	Condition	ICD10CM	Valid	Non-standard
35207749	I39	Endocarditis and heart valve disorders in diseases classified elsewhere	3-char billing code	Condition	ICD10CM	Valid	Non-standard
35207754	I41	Myocarditis in diseases classified elsewhere	3-char billing code	Condition	ICD10CM	Valid	Non-standard
35207765	I43	Cardiomyopathy in diseases classified elsewhere	3-char billing code	Condition	ICD10CM	Valid	Non-standard
35207795	I51.1	Rupture of chordae tendineae, not elsewhere classified	4-char billing code	Condition	ICD10CM	Valid	Non-standard
35207796	I51.2	Rupture of papillary muscle, not elsewhere classified	4-char billing code	Condition	ICD10CM	Valid	Non-standard
35207797	I51.3	Intracardiac thrombosis, not elsewhere classified	4-char billing code	Condition	ICD10CM	Valid	Non-standard
35207802	I52	Other heart disorders in diseases classified elsewhere	3-char billing code	Condition	ICD10CM	Valid	Non-standard
35207835	I67.7	Cerebral arteritis, not elsewhere classified	4-char billing code	Condition	ICD10CM	Valid	Non-standard
35207839	I68.2	Cerebral arteritis in other diseases classified elsewhere	4-char billing code	Condition	ICD10CM	Valid	Non-standard
35207840	I68.8	Other cerebrovascular disorders in diseases classified elsewhere	4-char billing code	Condition	ICD10CM	Valid	Non-standard
35207881	I79.0	Aneurysm of aorta in diseases classified elsewhere	4-char billing code	Condition	ICD10CM	Valid	Non-standard
35207882	I79.1	Aortitis in diseases classified elsewhere	4-char billing code	Condition	ICD10CM	Valid	Non-standard
35207883	I79.8	Other disorders of arteries, arterioles and capillaries in diseases classified elsewhere	4-char billing code	Condition	ICD10CM	Valid	Non-standard
35207911	I89.0	Lymphedema, not elsewhere classified	4-char billing code	Condition	ICD10CM	Valid	Non-standard
35207951	J17	Pneumonia in diseases classified elsewhere	3-char billing code	Condition	ICD10CM	Valid	Non-standard
35208054	J68.2	Upper respiratory inflammation due to chemicals, gases, fumes and vapors, not elsewhere classified	4-char billing code	Condition	ICD10CM	Valid	Non-standard
35208070	J82	Pulmonary eosinophilia, not elsewhere classified	3-char nonbill code	Condition	ICD10CM	Valid	Non-standard
35208081	J90	Pleural effusion, not elsewhere classified	3-char billing code	Condition	ICD10CM	Valid	Non-standard
35208106	J98.5	Diseases of mediastinum, not elsewhere classified	4-char nonbill code	Condition	ICD10CM	Valid	Non-standard
35208110	J99	Respiratory disorders in diseases classified elsewhere	3-char billing code	Condition	ICD10CM	Valid	Non-standard
35208116	K00.5	Hereditary disturbances in tooth structure, not elsewhere classified	4-char billing code	Condition	ICD10CM	Valid	Non-standard
35208157	K09.8	Other cysts of oral region, not elsewhere classified	4-char billing code	Condition	ICD10CM	Valid	Non-standard
35208200	K23	Disorders of esophagus in diseases classified elsewhere	3-char billing code	Condition	ICD10CM	Valid	Non-standard
35208241	K31.3	Pylorospasm, not elsewhere classified	4-char billing code	Condition	ICD10CM	Valid	Non-standard
35208289	K59.2	Neurogenic bowel, not elsewhere classified	4-char billing code	Condition	ICD10CM	Valid	Non-standard
35208290	K59.3	Megacolon, not elsewhere classified	4-char nonbill code	Condition	ICD10CM	Valid	Non-standard
35208329	K67	Disorders of peritoneum in infectious diseases classified elsewhere	3-char billing code	Condition	ICD10CM	Valid	Non-standard
35208337	K71.6	Toxic liver disease with hepatitis, not elsewhere classified	4-char billing code	Condition	ICD10CM	Valid	Non-standard
35208341	K73.0	Chronic persistent hepatitis, not elsewhere classified	4-char billing code	Condition	ICD10CM	Valid	Non-standard
35208342	K73.1	Chronic lobular hepatitis, not elsewhere classified	4-char billing code	Condition	ICD10CM	Valid	Non-standard
35208343	K73.2	Chronic active hepatitis, not elsewhere classified	4-char billing code	Condition	ICD10CM	Valid	Non-standard
35208344	K73.8	Other chronic hepatitis, not elsewhere classified	4-char billing code	Condition	ICD10CM	Valid	Non-standard
35208355	K75.3	Granulomatous hepatitis, not elsewhere classified	4-char billing code	Condition	ICD10CM	Valid	Non-standard
35208359	K76.0	Fatty (change of) liver, not elsewhere classified	4-char billing code	Condition	ICD10CM	Valid	Non-standard
35208369	K77	Liver disorders in diseases classified elsewhere	3-char billing code	Condition	ICD10CM	Valid	Non-standard
35208400	K87	Disorders of gallbladder, biliary tract and pancreas in diseases classified elsewhere	3-char billing code	Condition	ICD10CM	Valid	Non-standard
35208403	K90.2	Blind loop syndrome, not elsewhere classified	4-char billing code	Condition	ICD10CM	Valid	Non-standard
35208409	K91.2	Postsurgical malabsorption, not elsewhere classified	4-char billing code	Condition	ICD10CM	Valid	Non-standard
35208448	L14	Bullous disorders in diseases classified elsewhere	3-char billing code	Condition	ICD10CM	Valid	Non-standard
35208534	L45	Papulosquamous disorders in diseases classified elsewhere	3-char billing code	Condition	ICD10CM	Valid	Non-standard
35208556	L54	Erythema in diseases classified elsewhere	3-char billing code	Condition	ICD10CM	Valid	Non-standard
35208590	L62	Nail disorders in diseases classified elsewhere	3-char billing code	Condition	ICD10CM	Valid	Non-standard
35208661	L81.5	Leukoderma, not elsewhere classified	4-char billing code	Condition	ICD10CM	Valid	Non-standard
35208674	L86	Keratoderma in diseases classified elsewhere	3-char billing code	Condition	ICD10CM	Valid	Non-standard
35208694	L92.1	Necrobiosis lipoidica, not elsewhere classified	4-char billing code	Condition	ICD10CM	Valid	Non-standard
35208723	L99	Other disorders of skin and subcutaneous tissue in diseases classified elsewhere	3-char billing code	Condition	ICD10CM	Valid	Non-standard
35208845	M36.4	Arthropathy in hypersensitivity reactions classified elsewhere	4-char billing code	Condition	ICD10CM	Valid	Non-standard
35208846	M36.8	Systemic disorders of connective tissue in other diseases classified elsewhere	4-char billing code	Condition	ICD10CM	Valid	Non-standard
35208870	M46.1	Sacroiliitis, not elsewhere classified	4-char billing code	Condition	ICD10CM	Valid	Non-standard
35208966	M53.3	Sacrococcygeal disorders, not elsewhere classified	4-char billing code	Condition	ICD10CM	Valid	Non-standard
35209003	M77.8	Other enthesopathies, not elsewhere classified	4-char billing code	Condition	ICD10CM	Valid	Non-standard
35209150	M96.1	Postlaminectomy syndrome, not elsewhere classified	4-char billing code	Condition	ICD10CM	Valid	Non-standard
35209235	N07.0	Hereditary nephropathy, not elsewhere classified with minor glomerular abnormality	4-char billing code	Condition	ICD10CM	Valid	Non-standard
35209236	N07.1	Hereditary nephropathy, not elsewhere classified with focal and segmental glomerular lesions	4-char billing code	Condition	ICD10CM	Valid	Non-standard
35209237	N07.2	Hereditary nephropathy, not elsewhere classified with diffuse membranous glomerulonephritis	4-char billing code	Condition	ICD10CM	Valid	Non-standard
35209238	N07.3	Hereditary nephropathy, not elsewhere classified with diffuse mesangial proliferative glomerulonephritis	4-char billing code	Condition	ICD10CM	Valid	Non-standard
35209239	N07.4	Hereditary nephropathy, not elsewhere classified with diffuse endocapillary proliferative glomerulonephritis	4-char billing code	Condition	ICD10CM	Valid	Non-standard
35209240	N07.5	Hereditary nephropathy, not elsewhere classified with diffuse mesangiocapillary glomerulonephritis	4-char billing code	Condition	ICD10CM	Valid	Non-standard
35209241	N07.6	Hereditary nephropathy, not elsewhere classified with dense deposit disease	4-char billing code	Condition	ICD10CM	Valid	Non-standard
35209242	N07.7	Hereditary nephropathy, not elsewhere classified with diffuse crescentic glomerulonephritis	4-char billing code	Condition	ICD10CM	Valid	Non-standard
35209243	N07.8	Hereditary nephropathy, not elsewhere classified with other morphologic lesions	4-char billing code	Condition	ICD10CM	Valid	Non-standard
35209244	N07.9	Hereditary nephropathy, not elsewhere classified with unspecified morphologic lesions	4-char billing code	Condition	ICD10CM	Valid	Non-standard
35209245	N08	Glomerular disorders in diseases classified elsewhere	3-char billing code	Condition	ICD10CM	Valid	Non-standard
35209252	N13.1	Hydronephrosis with ureteral stricture, not elsewhere classified	4-char billing code	Condition	ICD10CM	Valid	Non-standard
35209263	N14.4	Toxic nephropathy, not elsewhere classified	4-char billing code	Condition	ICD10CM	Valid	Non-standard
35209268	N16	Renal tubulo-interstitial disorders in diseases classified elsewhere	3-char billing code	Condition	ICD10CM	Valid	Non-standard
35209289	N22	Calculus of urinary tract in diseases classified elsewhere	3-char billing code	Condition	ICD10CM	Valid	Non-standard
35209300	N29	Other disorders of kidney and ureter in diseases classified elsewhere	3-char billing code	Condition	ICD10CM	Valid	Non-standard
35209302	N31.1	Reflex neuropathic bladder, not elsewhere classified	4-char billing code	Condition	ICD10CM	Valid	Non-standard
35209308	N32.2	Vesical fistula, not elsewhere classified	4-char billing code	Condition	ICD10CM	Valid	Non-standard
35209311	N33	Bladder disorders in diseases classified elsewhere	3-char billing code	Condition	ICD10CM	Valid	Non-standard
35209323	N37	Urethral disorders in diseases classified elsewhere	3-char billing code	Condition	ICD10CM	Valid	Non-standard
35209354	N51	Disorders of male genital organs in diseases classified elsewhere	3-char billing code	Condition	ICD10CM	Valid	Non-standard
35209378	N74	Female pelvic inflammatory disorders in diseases classified elsewhere	3-char billing code	Condition	ICD10CM	Valid	Non-standard
35209390	N77.0	Ulceration of vulva in diseases classified elsewhere	4-char billing code	Condition	ICD10CM	Valid	Non-standard
35209391	N77.1	Vaginitis, vulvitis and vulvovaginitis in diseases classified elsewhere	4-char billing code	Condition	ICD10CM	Valid	Non-standard
35210357	O75.2	Pyrexia during labor, not elsewhere classified	4-char billing code	Condition	ICD10CM	Valid	Non-standard
35210402	P00.7	Newborn affected by other medical procedures on mother, not elsewhere classified	4-char billing code	Condition	ICD10CM	Valid	Non-standard
35210544	P39.2	Intra-amniotic infection affecting newborn, not elsewhere classified	4-char billing code	Condition	ICD10CM	Valid	Non-standard
35210603	P61.4	Other congenital anemias, not elsewhere classified	4-char billing code	Condition	ICD10CM	Valid	Non-standard
35210622	P72.0	Neonatal goiter, not elsewhere classified	4-char billing code	Condition	ICD10CM	Valid	Non-standard
35210624	P72.2	Other transitory neonatal disorders of thyroid function, not elsewhere classified	4-char billing code	Condition	ICD10CM	Valid	Non-standard
35210910	Q38.0	Congenital malformations of lips, not elsewhere classified	4-char billing code	Condition	ICD10CM	Valid	Non-standard
35210915	Q38.5	Congenital malformations of palate, not elsewhere classified	4-char billing code	Condition	ICD10CM	Valid	Non-standard
35211007	Q56.0	Hermaphroditism, not elsewhere classified	4-char billing code	Condition	ICD10CM	Valid	Non-standard
35211008	Q56.1	Male pseudohermaphroditism, not elsewhere classified	4-char billing code	Condition	ICD10CM	Valid	Non-standard
35211009	Q56.2	Female pseudohermaphroditism, not elsewhere classified	4-char billing code	Condition	ICD10CM	Valid	Non-standard
35211172	Q84.1	Congenital morphological disturbances of hair, not elsewhere classified	4-char billing code	Condition	ICD10CM	Valid	Non-standard
35211182	Q85.8	Other phakomatoses, not elsewhere classified	4-char nonbill code	Condition	ICD10CM	Valid	Non-standard
35211197	Q89.7	Multiple congenital malformations, not elsewhere classified	4-char billing code	Condition	ICD10CM	Valid	Non-standard
35211295	R16.0	Hepatomegaly, not elsewhere classified	4-char billing code	Condition	ICD10CM	Valid	Non-standard
35211296	R16.1	Splenomegaly, not elsewhere classified	4-char billing code	Condition	ICD10CM	Valid	Non-standard
35211297	R16.2	Hepatomegaly with splenomegaly, not elsewhere classified	4-char billing code	Condition	ICD10CM	Valid	Non-standard
35211396	R58	Hemorrhage, not elsewhere classified	3-char billing code	Condition	ICD10CM	Valid	Non-standard
37081689	D53.1	Other megaloblastic anaemias, not elsewhere classified	ICD10 code	Condition	ICD10GM	Valid	Non-standard
37081746	D63	Anaemia in chronic diseases classified elsewhere	ICD10 Hierarchy	Condition	ICD10GM	Valid	Non-standard
37081748	D63.8	Anaemia in other chronic diseases classified elsewhere	ICD10 code	Condition	ICD10GM	Valid	Non-standard
37081884	D76.0	Langerhans' cell histiocytosis, not elsewhere classified	ICD10 code	Condition	ICD10GM	Invalid	Non-standard
37081887	D76.08	Other and unspecified Langerhans cell histiocytosis, not elsewhere classified	ICD10 code	Condition	ICD10GM	Invalid	Non-standard
37081892	D77	Other disorders of blood and blood-forming organs in diseases classified elsewhere	ICD10 Hierarchy	Condition	ICD10GM	Valid	Non-standard
37081942	D89	Other disorders involving the immune mechanism, not elsewhere classified	ICD10 Hierarchy	Condition	ICD10GM	Valid	Non-standard
37081947	D89.8	Other specified disorders involving the immune mechanism, not elsewhere classified	ICD10 code	Condition	ICD10GM	Valid	Non-standard
37082098	A05	Other bacterial foodborne intoxications, not elsewhere classified	ICD10 Hierarchy	Condition	ICD10GM	Valid	Non-standard
37082196	E21.1	Secondary hyperparathyroidism, not elsewhere classified	ICD10 code	Condition	ICD10GM	Valid	Non-standard
37082211	E23.3	Hypothalamic dysfunction, not elsewhere classified	ICD10 code	Condition	ICD10GM	Valid	Non-standard
37082256	E30	Disorders of puberty, not elsewhere classified	ICD10 Hierarchy	Condition	ICD10GM	Valid	Non-standard
37082276	E34.2	Ectopic hormone secretion, not elsewhere classified	ICD10 code	Condition	ICD10GM	Valid	Non-standard
37082277	E34.3	Short stature, not elsewhere classified	ICD10 code	Condition	ICD10GM	Valid	Non-standard
37082285	E35	Disorders of endocrine glands in diseases classified elsewhere	ICD10 Hierarchy	Condition	ICD10GM	Valid	Non-standard
37082286	E35.0	Disorders of thyroid gland in diseases classified elsewhere	ICD10 code	Condition	ICD10GM	Valid	Non-standard
37082287	E35.1	Disorders of adrenal glands in diseases classified elsewhere	ICD10 code	Condition	ICD10GM	Valid	Non-standard
37082288	E35.8	Disorders of other endocrine glands in diseases classified elsewhere	ICD10 code	Condition	ICD10GM	Valid	Non-standard
37082522	E87.8	Other disorders of electrolyte and fluid balance, not elsewhere classified	ICD10 code	Condition	ICD10GM	Valid	Non-standard
37082524	E88.0	Disorders of plasma-protein metabolism, not elsewhere classified	ICD10 code	Condition	ICD10GM	Valid	Non-standard
37082525	E88.1	Lipodystrophy, not elsewhere classified	ICD10 code	Condition	ICD10GM	Valid	Non-standard
37082526	E88.2	Lipomatosis, not elsewhere classified	ICD10 code	Condition	ICD10GM	Valid	Non-standard
37082531	E88.29	Other lipomatosis, not elsewhere classified	ICD10 code	Condition	ICD10GM	Valid	Non-standard
37082535	E89	Postprocedural endocrine and metabolic disorders, not elsewhere classified	ICD10 Hierarchy	Condition	ICD10GM	Valid	Non-standard
37082545	E90	Nutritional and metabolic disorders in diseases classified elsewhere	ICD10 Hierarchy	Condition	ICD10GM	Valid	Non-standard
37082558	F02	Dementia in other diseases classified elsewhere	ICD10 Hierarchy	Condition	ICD10GM	Valid	Non-standard
37082564	F02.8	Dementia in other specified diseases classified elsewhere	ICD10 code	Condition	ICD10GM	Valid	Non-standard
37082922	F53	Mental and behavioural disorders associated with the puerperium, not elsewhere classified	ICD10 Hierarchy	Condition	ICD10GM	Valid	Non-standard
37082923	F53.0	Mild mental and behavioural disorders associated with the puerperium, not elsewhere classified	ICD10 code	Condition	ICD10GM	Valid	Non-standard
37082924	F53.1	Severe mental and behavioural disorders associated with the puerperium, not elsewhere classified	ICD10 code	Condition	ICD10GM	Valid	Non-standard
37082925	F53.8	Other mental and behavioural disorders associated with the puerperium, not elsewhere classified	ICD10 code	Condition	ICD10GM	Valid	Non-standard
37083159	G00	Bacterial meningitis, not elsewhere classified	ICD10 Hierarchy	Condition	ICD10GM	Valid	Non-standard
37083166	G01	Meningitis in bacterial diseases classified elsewhere	ICD10 Hierarchy	Condition	ICD10GM	Valid	Non-standard
37083167	G02	Meningitis in other infectious and parasitic diseases classified elsewhere	ICD10 Hierarchy	Condition	ICD10GM	Valid	Non-standard
37083168	G02.0	Meningitis in viral diseases classified elsewhere	ICD10 code	Condition	ICD10GM	Valid	Non-standard
37083170	G02.8	Meningitis in other specified infectious and parasitic diseases classified elsewhere	ICD10 code	Condition	ICD10GM	Valid	Non-standard
37083204	A28	Other zoonotic bacterial diseases, not elsewhere classified	ICD10 Hierarchy	Condition	ICD10GM	Valid	Non-standard
37083208	A28.8	Other specified zoonotic bacterial diseases, not elsewhere classified	ICD10 code	Condition	ICD10GM	Valid	Non-standard
37083228	G04.2	Bacterial meningoencephalitis and meningomyelitis, not elsewhere classified	ICD10 code	Condition	ICD10GM	Valid	Non-standard
37083231	G05	Encephalitis, myelitis and encephalomyelitis in diseases classified elsewhere	ICD10 Hierarchy	Condition	ICD10GM	Valid	Non-standard
37083232	G05.0	Encephalitis, myelitis and encephalomyelitis in bacterial diseases classified elsewhere	ICD10 code	Condition	ICD10GM	Valid	Non-standard
37083233	G05.1	Encephalitis, myelitis and encephalomyelitis in viral diseases classified elsewhere	ICD10 code	Condition	ICD10GM	Valid	Non-standard
37083234	G05.2	Encephalitis, myelitis and encephalomyelitis in other infectious and parasitic diseases classified elsewhere	ICD10 code	Condition	ICD10GM	Valid	Non-standard
37083235	G05.8	Encephalitis, myelitis and encephalomyelitis in other diseases classified elsewhere	ICD10 code	Condition	ICD10GM	Valid	Non-standard
37083240	G07	Intracranial and intraspinal abscess and granuloma in diseases classified elsewhere	ICD10 Hierarchy	Condition	ICD10GM	Valid	Non-standard
37083258	G13	Systemic atrophies primarily affecting central nervous system in diseases classified elsewhere	ICD10 Hierarchy	Condition	ICD10GM	Valid	Non-standard
37083263	G13.8	Systemic atrophy primarily affecting central nervous system in other diseases classified elsewhere	ICD10 code	Condition	ICD10GM	Valid	Non-standard
37083286	G22	Parkinsonism in diseases classified elsewhere	ICD10 Hierarchy	Condition	ICD10GM	Valid	Non-standard
37083314	G26	Extrapyramidal and movement disorders in diseases classified elsewhere	ICD10 Hierarchy	Condition	ICD10GM	Valid	Non-standard
37083320	G31	Other degenerative diseases of nervous system, not elsewhere classified	ICD10 Hierarchy	Condition	ICD10GM	Valid	Non-standard
37083333	G31.1	Senile degeneration of brain, not elsewhere classified	ICD10 code	Condition	ICD10GM	Valid	Non-standard
37083339	G32	Other degenerative disorders of nervous system in diseases classified elsewhere	ICD10 Hierarchy	Condition	ICD10GM	Valid	Non-standard
37083340	G32.0	Subacute combined degeneration of spinal cord in diseases classified elsewhere	ICD10 code	Condition	ICD10GM	Valid	Non-standard
37083341	G32.8	Other specified degenerative disorders of nervous system in diseases classified elsewhere	ICD10 code	Condition	ICD10GM	Valid	Non-standard
37083404	G44.1	Vascular headache, not elsewhere classified	ICD10 code	Condition	ICD10GM	Valid	Non-standard
37083407	G44.4	Drug-induced headache, not elsewhere classified	ICD10 code	Condition	ICD10GM	Valid	Non-standard
37083503	G53	Cranial nerve disorders in diseases classified elsewhere	ICD10 Hierarchy	Condition	ICD10GM	Valid	Non-standard
37083504	G53.1	Multiple cranial nerve palsies in infectious and parasitic diseases classified elsewhere	ICD10 code	Condition	ICD10GM	Valid	Non-standard
37083507	G53.8	Other cranial nerve disorders in other diseases classified elsewhere	ICD10 code	Condition	ICD10GM	Valid	Non-standard
37083511	G54.2	Cervical root disorders, not elsewhere classified	ICD10 code	Condition	ICD10GM	Valid	Non-standard
37083512	G54.3	Thoracic root disorders, not elsewhere classified	ICD10 code	Condition	ICD10GM	Valid	Non-standard
37083513	G54.4	Lumbosacral root disorders, not elsewhere classified	ICD10 code	Condition	ICD10GM	Valid	Non-standard
37083519	G55	Nerve root and plexus compressions in diseases classified elsewhere	ICD10 Hierarchy	Condition	ICD10GM	Valid	Non-standard
37083524	G55.8	Nerve root and plexus compressions in other diseases classified elsewhere	ICD10 code	Condition	ICD10GM	Valid	Non-standard
37083549	G59	Mononeuropathy in diseases classified elsewhere	ICD10 Hierarchy	Condition	ICD10GM	Valid	Non-standard
37083551	G59.8	Other mononeuropathies in diseases classified elsewhere	ICD10 code	Condition	ICD10GM	Valid	Non-standard
37083572	G63	Polyneuropathy in diseases classified elsewhere	ICD10 Hierarchy	Condition	ICD10GM	Valid	Non-standard
37083573	G63.0	Polyneuropathy in infectious and parasitic diseases classified elsewhere	ICD10 code	Condition	ICD10GM	Valid	Non-standard
37083580	G63.8	Polyneuropathy in other diseases classified elsewhere	ICD10 code	Condition	ICD10GM	Valid	Non-standard
37083592	G71.3	Mitochondrial myopathy, not elsewhere classified	ICD10 code	Condition	ICD10GM	Valid	Non-standard
37083600	G72.4	Inflammatory myopathy, not elsewhere classified	ICD10 code	Condition	ICD10GM	Valid	Non-standard
37083605	G73	Disorders of myoneural junction and muscle in diseases classified elsewhere	ICD10 Hierarchy	Condition	ICD10GM	Valid	Non-standard
37083609	G73.3	Myasthenic syndromes in other diseases classified elsewhere	ICD10 code	Condition	ICD10GM	Valid	Non-standard
37083610	G73.4	Myopathy in infectious and parasitic diseases classified elsewhere	ICD10 code	Condition	ICD10GM	Valid	Non-standard
37083613	G73.7	Myopathy in other diseases classified elsewhere	ICD10 code	Condition	ICD10GM	Valid	Non-standard
37083767	G93.1	Anoxic brain damage, not elsewhere classified	ICD10 code	Condition	ICD10GM	Valid	Non-standard
37083778	G94	Other disorders of brain in diseases classified elsewhere	ICD10 Hierarchy	Condition	ICD10GM	Valid	Non-standard
37083779	G94.0	Hydrocephalus in infectious and parasitic diseases classified elsewhere	ICD10 code	Condition	ICD10GM	Valid	Non-standard
37083781	G94.2	Hydrocephalus in other diseases classified elsewhere	ICD10 code	Condition	ICD10GM	Valid	Non-standard
37083782	G94.3	Encephalopathy in diseases classified elsewhere	ICD10 code	Condition	ICD10GM	Valid	Non-standard
37083783	G94.8	Other specified disorders of brain in diseases classified elsewhere	ICD10 code	Condition	ICD10GM	Valid	Non-standard
37083811	G96.1	Disorders of meninges, not elsewhere classified	ICD10 code	Condition	ICD10GM	Valid	Non-standard
37083814	G97	Postprocedural disorders of nervous system, not elsewhere classified	ICD10 Hierarchy	Condition	ICD10GM	Valid	Non-standard
37083826	G98	Other disorders of nervous system, not elsewhere classified	ICD10 Hierarchy	Condition	ICD10GM	Valid	Non-standard
37083827	G99	Other disorders of nervous system in diseases classified elsewhere	ICD10 Hierarchy	Condition	ICD10GM	Valid	Non-standard
37083829	G99.1	Other disorders of autonomic nervous system in other diseases classified elsewhere	ICD10 code	Condition	ICD10GM	Valid	Non-standard
37083830	G99.2	Myelopathy in diseases classified elsewhere	ICD10 code	Condition	ICD10GM	Valid	Non-standard
37083831	G99.8	Other specified disorders of nervous system in diseases classified elsewhere	ICD10 code	Condition	ICD10GM	Valid	Non-standard
37083854	H03	Disorders of eyelid in diseases classified elsewhere	ICD10 Hierarchy	Condition	ICD10GM	Valid	Non-standard
37083855	H03.0	Parasitic infestation of eyelid in diseases classified elsewhere	ICD10 code	Condition	ICD10GM	Valid	Non-standard
37083856	H03.1	Involvement of eyelid in other infectious diseases classified elsewhere	ICD10 code	Condition	ICD10GM	Valid	Non-standard
37083857	H03.8	Involvement of eyelid in other diseases classified elsewhere	ICD10 code	Condition	ICD10GM	Valid	Non-standard
37083876	H06	Disorders of lacrimal system and orbit in diseases classified elsewhere	ICD10 Hierarchy	Condition	ICD10GM	Valid	Non-standard
37083877	H06.0	Disorders of lacrimal system in diseases classified elsewhere	ICD10 code	Condition	ICD10GM	Valid	Non-standard
37083878	H06.1	Parasitic infestation of orbit in diseases classified elsewhere	ICD10 code	Condition	ICD10GM	Valid	Non-standard
37083880	H06.3	Other disorders of orbit in diseases classified elsewhere	ICD10 code	Condition	ICD10GM	Valid	Non-standard
37083898	H13	Disorders of conjunctiva in diseases classified elsewhere	ICD10 Hierarchy	Condition	ICD10GM	Valid	Non-standard
37083900	H13.1	Conjunctivitis in infectious and parasitic diseases classified elsewhere	ICD10 code	Condition	ICD10GM	Valid	Non-standard
