Id	Code	Name	Standard Class	Domain	Vocab	Validity	Concept
37613533	K59.2	Neurogenic bowel, not elsewhere classified	ICD10 code	Condition	CIM10	Valid	Non-standard
37613538	K73	Chronic hepatitis, not elsewhere classified	ICD10 Hierarchy	Condition	CIM10	Valid	Non-standard
37613542	K87.0	Disorders of gallbladder and biliary tract in diseases classified elsewhere	ICD10 code	Condition	CIM10	Valid	Non-standard
37613584	E35.0	Disorders of thyroid gland in diseases classified elsewhere	ICD10 code	Condition	CIM10	Valid	Non-standard
37613602	T88.8	Other specified complications of surgical and medical care, not elsewhere classified	ICD10 code	Condition	CIM10	Valid	Non-standard
37613628	L92.1	Necrobiosis lipoidica, not elsewhere classified	ICD10 code	Condition	CIM10	Valid	Non-standard
37613632	L98	Other disorders of skin and subcutaneous tissue, not elsewhere classified	ICD10 Hierarchy	Condition	CIM10	Valid	Non-standard
37613642	L62	Nail disorders in diseases classified elsewhere	ICD10 Hierarchy	Condition	CIM10	Valid	Non-standard
37613670	N13.1	Hydronephrosis with ureteral stricture, not elsewhere classified	ICD10 code	Condition	CIM10	Valid	Non-standard
37613708	T44.7	Poisoning: Beta-adrenoreceptor antagonists, not elsewhere classified	ICD10 code	Condition	CIM10	Valid	Non-standard
37613724	H58.1	Visual disturbances in diseases classified elsewhere	ICD10 code	Condition	CIM10	Valid	Non-standard
37613744	M46.1	Sacroiliitis, not elsewhere classified	ICD10 code	Condition	CIM10	Valid	Non-standard
37613813	G44.4	Drug-induced headache, not elsewhere classified	ICD10 code	Condition	CIM10	Valid	Non-standard
37613852	M63.0	Myositis in bacterial diseases classified elsewhere	ICD10 code	Condition	CIM10	Valid	Non-standard
37613936	H03.1	Involvement of eyelid in other infectious diseases classified elsewhere	ICD10 code	Condition	CIM10	Valid	Non-standard
37613998	M24.3	Pathological dislocation and subluxation of joint, not elsewhere classified	ICD10 code	Condition	CIM10	Valid	Non-standard
37614029	H19.3	Keratitis and keratoconjunctivitis in other diseases classified elsewhere	ICD10 code	Condition	CIM10	Valid	Non-standard
37614037	H06.0	Disorders of lacrimal system in diseases classified elsewhere	ICD10 code	Condition	CIM10	Valid	Non-standard
37614040	M62.5	Muscle wasting and atrophy, not elsewhere classified	ICD10 code	Condition	CIM10	Valid	Non-standard
37614042	M68.0	Synovitis and tenosynovitis in bacterial diseases classified elsewhere	ICD10 code	Condition	CIM10	Valid	Non-standard
37614067	M24.8	Other specific joint derangements, not elsewhere classified	ICD10 code	Condition	CIM10	Valid	Non-standard
37614171	I39.4	Multiple valve disorders in diseases classified elsewhere	ICD10 code	Condition	CIM10	Valid	Non-standard
37614188	M90.5	Osteonecrosis in other diseases classified elsewhere	ICD10 code	Condition	CIM10	Valid	Non-standard
37614240	T43	Poisoning by psychotropic drugs, not elsewhere classified	ICD10 Hierarchy	Condition	CIM10	Valid	Non-standard
37614269	L86	Keratoderma in diseases classified elsewhere	ICD10 Hierarchy	Condition	CIM10	Valid	Non-standard
37614278	E35.1	Disorders of adrenal glands in diseases classified elsewhere	ICD10 code	Condition	CIM10	Valid	Non-standard
37614290	T88.1	Other complications following immunization, not elsewhere classified	ICD10 code	Condition	CIM10	Valid	Non-standard
37614310	D89.8	Other specified disorders involving the immune mechanism, not elsewhere classified	ICD10 code	Condition	CIM10	Valid	Non-standard
37614326	E30	Disorders of puberty, not elsewhere classified	ICD10 Hierarchy	Condition	CIM10	Valid	Non-standard
37614344	T44.8	Poisoning: Centrally acting and adrenergic-neuron-blocking agents, not elsewhere classified	ICD10 code	Condition	CIM10	Valid	Non-standard
37614358	N37.8	Other urethral disorders in diseases classified elsewhere	ICD10 code	Condition	CIM10	Valid	Non-standard
37614379	F53	Mental and behavioural disorders associated with the puerperium, not elsewhere classified	ICD10 Hierarchy	Condition	CIM10	Valid	Non-standard
37614393	G02.0	Meningitis in viral diseases classified elsewhere	ICD10 code	Condition	CIM10	Valid	Non-standard
37614402	N35.1	Postinfective urethral stricture, not elsewhere classified	ICD10 code	Condition	CIM10	Valid	Non-standard
37614427	G05.0	Encephalitis, myelitis and encephalomyelitis in bacterial diseases classified elsewhere	ICD10 code	Condition	CIM10	Valid	Non-standard
37614436	G53.1	Multiple cranial nerve palsies in infectious and parasitic diseases classified elsewhere	ICD10 code	Condition	CIM10	Valid	Non-standard
37614444	N51.1	Disorders of testis and epididymis in diseases classified elsewhere	ICD10 code	Condition	CIM10	Valid	Non-standard
37614484	T44.2	Poisoning: Ganglionic blocking drugs, not elsewhere classified	ICD10 code	Condition	CIM10	Valid	Non-standard
37614503	G99.8	Other specified disorders of nervous system in diseases classified elsewhere	ICD10 code	Condition	CIM10	Valid	Non-standard
37614509	N90.2	Severe vulvar dysplasia, not elsewhere classified	ICD10 code	Condition	CIM10	Valid	Non-standard
37614542	G05.8	Encephalitis, myelitis and encephalomyelitis in other diseases classified elsewhere	ICD10 code	Condition	CIM10	Valid	Non-standard
37614554	T49.0	Poisoning: Local antifungal, anti-infective and anti-inflammatory drugs, not elsewhere classified	ICD10 code	Condition	CIM10	Valid	Non-standard
37614590	G44.1	Vascular headache, not elsewhere classified	ICD10 code	Condition	CIM10	Valid	Non-standard
37614596	G71.3	Mitochondrial myopathy, not elsewhere classified	ICD10 code	Condition	CIM10	Valid	Non-standard
37614700	H03.8	Involvement of eyelid in other diseases classified elsewhere	ICD10 code	Condition	CIM10	Valid	Non-standard
37614725	M03.2	Other postinfectious arthropathies in diseases classified elsewhere	ICD10 code	Condition	CIM10	Valid	Non-standard
37614837	H22.0	Iridocyclitis in infectious and parasitic diseases classified elsewhere	ICD10 code	Condition	CIM10	Valid	Non-standard
37614838	H22.8	Other disorders of iris and ciliary body in diseases classified elsewhere	ICD10 code	Condition	CIM10	Valid	Non-standard
37614839	H28	Cataract and other disorders of lens in diseases classified elsewhere	ICD10 Hierarchy	Condition	CIM10	Valid	Non-standard
37614840	H28.8	Other disorders of lens in diseases classified elsewhere	ICD10 code	Condition	CIM10	Valid	Non-standard
37614868	M12.8	Other specific arthropathies, not elsewhere classified	ICD10 code	Condition	CIM10	Valid	Non-standard
37614871	M21.0	Valgus deformity, not elsewhere classified	ICD10 code	Condition	CIM10	Valid	Non-standard
37614887	Q84.1	Congenital morphological disturbances of hair, not elsewhere classified	ICD10 code	Condition	CIM10	Valid	Non-standard
37614891	Q95	Balanced rearrangements and structural markers, not elsewhere classified	ICD10 Hierarchy	Condition	CIM10	Valid	Non-standard
37614903	R48	Dyslexia and other symbolic dysfunctions, not elsewhere classified	ICD10 Hierarchy	Condition	CIM10	Valid	Non-standard
37614905	R60	Oedema, not elsewhere classified	ICD10 Hierarchy	Condition	CIM10	Valid	Non-standard
37614929	P96.5	Complications of intrauterine procedures, not elsewhere classified	ICD10 code	Condition	CIM10	Valid	Non-standard
37614970	H75.8	Other specified disorders of middle ear and mastoid in diseases classified elsewhere	ICD10 code	Condition	CIM10	Valid	Non-standard
37614972	H91.3	Deaf mutism, not elsewhere classified	ICD10 code	Condition	CIM10	Valid	Non-standard
37614973	H93	Other disorders of ear, not elsewhere classified	ICD10 Hierarchy	Condition	CIM10	Valid	Non-standard
37615029	B33.3	Retrovirus infections, not elsewhere classified	ICD10 code	Condition	CIM10	Valid	Non-standard
37615053	B96.4	Proteus (mirabilis)(morganii) as the cause of diseases classified to other chapters	ICD10 code	Condition	CIM10	Valid	Non-standard
37615054	B97.5	Reovirus as the cause of diseases classified to other chapters	ICD10 code	Condition	CIM10	Valid	Non-standard
37615116	B23.2	HIV disease resulting in haematological and immunological abnormalities, not elsewhere classified	ICD10 code	Condition	CIM10	Valid	Non-standard
37615151	M71.5	Other bursitis, not elsewhere classified	ICD10 code	Condition	CIM10	Valid	Non-standard
37615158	T81.4	Infection following a procedure, not elsewhere classified	ICD10 code	Condition	CIM10	Valid	Non-standard
37615248	R58	Haemorrhage, not elsewhere classified	ICD10 Hierarchy	Condition	CIM10	Valid	Non-standard
37615251	M77.8	Other enthesopathies, not elsewhere classified	ICD10 code	Condition	CIM10	Valid	Non-standard
37615314	K09	Cysts of oral region, not elsewhere classified	ICD10 Hierarchy	Condition	CIM10	Valid	Non-standard
37615329	H82	Vertiginous syndromes in diseases classified elsewhere	ICD10 Hierarchy	Condition	CIM10	Valid	Non-standard
37615374	C84.4	Peripheral T-cell lymphoma, not elsewhere classified	ICD10 code	Condition	CIM10	Valid	Non-standard
37615386	S09.0	Injury of blood vessels of head, not elsewhere classified	ICD10 code	Condition	CIM10	Valid	Non-standard
37615388	T44.6	Poisoning: Alpha-adrenoreceptor antagonists, not elsewhere classified	ICD10 code	Condition	CIM10	Valid	Non-standard
37615553	B95.5	Unspecified streptococcus as the cause of diseases classified to other chapters	ICD10 code	Condition	CIM10	Valid	Non-standard
37615576	X42	Accidental poisoning by and exposure to narcotics and psychodysleptics [hallucinogens], not elsewhere classified	ICD10 Hierarchy	Condition	CIM10	Valid	Non-standard
37615579	Q86	Congenital malformation syndromes due to known exogenous causes, not elsewhere classified	ICD10 Hierarchy	Condition	CIM10	Valid	Non-standard
37615596	D63	Anaemia in chronic diseases classified elsewhere	ICD10 Hierarchy	Condition	CIM10	Valid	Non-standard
37615600	E89	Postprocedural endocrine and metabolic disorders, not elsewhere classified	ICD10 Hierarchy	Condition	CIM10	Valid	Non-standard
37615617	G73	Disorders of myoneural junction and muscle in diseases classified elsewhere	ICD10 Hierarchy	Condition	CIM10	Valid	Non-standard
37615619	G97	Postprocedural disorders of nervous system, not elsewhere classified	ICD10 Hierarchy	Condition	CIM10	Valid	Non-standard
37615620	G99	Other disorders of nervous system in diseases classified elsewhere	ICD10 Hierarchy	Condition	CIM10	Valid	Non-standard
37615635	H19	Disorders of sclera and cornea in diseases classified elsewhere	ICD10 Hierarchy	Condition	CIM10	Valid	Non-standard
37615637	H45	Disorders of vitreous body and globe in diseases classified elsewhere	ICD10 Hierarchy	Condition	CIM10	Valid	Non-standard
37615638	H45.1	Endophthalmitis in diseases classified elsewhere	ICD10 code	Condition	CIM10	Valid	Non-standard
37615639	H48	Disorders of optic [2nd] nerve and visual pathways in diseases classified elsewhere	ICD10 Hierarchy	Condition	CIM10	Valid	Non-standard
37615641	H03	Disorders of eyelid in diseases classified elsewhere	ICD10 Hierarchy	Condition	CIM10	Valid	Non-standard
37615642	H06	Disorders of lacrimal system and orbit in diseases classified elsewhere	ICD10 Hierarchy	Condition	CIM10	Valid	Non-standard
37615643	H06.1	Parasitic infestation of orbit in diseases classified elsewhere	ICD10 code	Condition	CIM10	Valid	Non-standard
37615644	H13	Disorders of conjunctiva in diseases classified elsewhere	ICD10 Hierarchy	Condition	CIM10	Valid	Non-standard
37615645	G05	Encephalitis, myelitis and encephalomyelitis in diseases classified elsewhere	ICD10 Hierarchy	Condition	CIM10	Valid	Non-standard
37615647	G13	Systemic atrophies primarily affecting central nervous system in diseases classified elsewhere	ICD10 Hierarchy	Condition	CIM10	Valid	Non-standard
37615648	G32	Other degenerative disorders of nervous system in diseases classified elsewhere	ICD10 Hierarchy	Condition	CIM10	Valid	Non-standard
37615691	T31	Burns classified according to extent of body surface involved	ICD10 Hierarchy	Condition	CIM10	Valid	Non-standard
37615692	T32	Corrosions classified according to extent of body surface involved	ICD10 Hierarchy	Condition	CIM10	Valid	Non-standard
37615710	P07	Disorders related to short gestation and low birth weight, not elsewhere classified	ICD10 Hierarchy	Condition	CIM10	Valid	Non-standard
37615712	A85	Other viral encephalitis, not elsewhere classified	ICD10 Hierarchy	Condition	CIM10	Valid	Non-standard
37615713	A88	Other viral infections of central nervous system, not elsewhere classified	ICD10 Hierarchy	Condition	CIM10	Valid	Non-standard
37615714	A93	Other arthropod-borne viral fevers, not elsewhere classified	ICD10 Hierarchy	Condition	CIM10	Valid	Non-standard
37615716	A63	Other predominantly sexually transmitted diseases, not elsewhere classified	ICD10 Hierarchy	Condition	CIM10	Valid	Non-standard
37615718	B60	Other protozoal diseases, not elsewhere classified	ICD10 Hierarchy	Condition	CIM10	Valid	Non-standard
37615720	B81	Other intestinal helminthiases, not elsewhere classified	ICD10 Hierarchy	Condition	CIM10	Valid	Non-standard
37615722	B95	Streptococcus and staphylococcus as the cause of diseases classified to other chapters	ICD10 Hierarchy	Condition	CIM10	Valid	Non-standard
37615723	B96	Other specified bacterial agents as the cause of diseases classified to other chapters	ICD10 Hierarchy	Condition	CIM10	Valid	Non-standard
37615729	B97	Viral agents as the cause of diseases classified to other chapters	ICD10 Hierarchy	Condition	CIM10	Valid	Non-standard
37615730	B98	Other specified infectious agents as the cause of diseases classified to other chapters	ICD10 Hierarchy	Condition	CIM10	Valid	Non-standard
37615731	B98.0	Helicobacter pylori [H.pylori] as the cause of diseases classified to other chapters	ICD10 code	Condition	CIM10	Valid	Non-standard
37615732	A98	Other viral haemorrhagic fevers, not elsewhere classified	ICD10 Hierarchy	Condition	CIM10	Valid	Non-standard
37615733	B08	Other viral infections characterized by skin and mucous membrane lesions, not elsewhere classified	ICD10 Hierarchy	Condition	CIM10	Valid	Non-standard
37615761	R16	Hepatomegaly and splenomegaly, not elsewhere classified	ICD10 Hierarchy	Condition	CIM10	Valid	Non-standard
37615773	R47	Speech disturbances, not elsewhere classified	ICD10 Hierarchy	Condition	CIM10	Valid	Non-standard
37615784	B33	Other viral diseases, not elsewhere classified	ICD10 Hierarchy	Condition	CIM10	Valid	Non-standard
37615785	B48	Other mycoses, not elsewhere classified	ICD10 Hierarchy	Condition	CIM10	Valid	Non-standard
37615872	N77	Vulvovaginal ulceration and inflammation in diseases classified elsewhere	ICD10 Hierarchy	Condition	CIM10	Valid	Non-standard
37615875	N99	Postprocedural disorders of genitourinary system, not elsewhere classified	ICD10 Hierarchy	Condition	CIM10	Valid	Non-standard
37615919	T06	Other injuries involving multiple body regions, not elsewhere classified	ICD10 Hierarchy	Condition	CIM10	Valid	Non-standard
37615957	M63	Disorders of muscle in diseases classified elsewhere	ICD10 Hierarchy	Condition	CIM10	Valid	Non-standard
37615958	M63.2	Myositis in other infectious diseases classified elsewhere	ICD10 code	Condition	CIM10	Valid	Non-standard
37615960	M68	Disorders of synovium and tendon in diseases classified elsewhere	ICD10 Hierarchy	Condition	CIM10	Valid	Non-standard
37615961	M82	Osteoporosis in diseases classified elsewhere	ICD10 Hierarchy	Condition	CIM10	Valid	Non-standard
37615962	M82.8	Osteoporosis in other diseases classified elsewhere	ICD10 code	Condition	CIM10	Valid	Non-standard
37615963	M90	Osteopathies in diseases classified elsewhere	ICD10 Hierarchy	Condition	CIM10	Valid	Non-standard
37615965	M96	Postprocedural musculoskeletal disorders, not elsewhere classified	ICD10 Hierarchy	Condition	CIM10	Valid	Non-standard
37615967	M73	Soft tissue disorders in diseases classified elsewhere	ICD10 Hierarchy	Condition	CIM10	Valid	Non-standard
37615969	M14	Arthropathies in other diseases classified elsewhere	ICD10 Hierarchy	Condition	CIM10	Valid	Non-standard
37616009	X62	Intentional self-poisoning by and exposure to narcotics and psychodysleptics [hallucinogens], not elsewhere classified	ICD10 Hierarchy	Condition	CIM10	Valid	Non-standard
37616010	I68	Cerebrovascular disorders in diseases classified elsewhere	ICD10 Hierarchy	Condition	CIM10	Valid	Non-standard
37616021	I79	Disorders of arteries, arterioles and capillaries in diseases classified elsewhere	ICD10 Hierarchy	Condition	CIM10	Valid	Non-standard
37616024	H58	Other disorders of eye and adnexa in diseases classified elsewhere	ICD10 Hierarchy	Condition	CIM10	Valid	Non-standard
37616025	H59	Postprocedural disorders of eye and adnexa, not elsewhere classified	ICD10 Hierarchy	Condition	CIM10	Valid	Non-standard
37616027	H62	Disorders of external ear in diseases classified elsewhere	ICD10 Hierarchy	Condition	CIM10	Valid	Non-standard
37616028	H67	Otitis media in diseases classified elsewhere	ICD10 Hierarchy	Condition	CIM10	Valid	Non-standard
37616031	H75	Other disorders of middle ear and mastoid in diseases classified elsewhere	ICD10 Hierarchy	Condition	CIM10	Valid	Non-standard
37616034	H94	Other disorders of ear in diseases classified elsewhere	ICD10 Hierarchy	Condition	CIM10	Valid	Non-standard
37616035	H95	Postprocedural disorders of ear and mastoid process, not elsewhere classified	ICD10 Hierarchy	Condition	CIM10	Valid	Non-standard
37616051	I97	Postprocedural disorders of circulatory system, not elsewhere classified	ICD10 Hierarchy	Condition	CIM10	Valid	Non-standard
37616052	I98	Other disorders of circulatory system in diseases classified elsewhere	ICD10 Hierarchy	Condition	CIM10	Valid	Non-standard
37616054	I98.3	Oesophageal varices with bleeding in diseases classified elsewhere	ICD10 code	Condition	CIM10	Valid	Non-standard
37616058	J16	Pneumonia due to other infectious organisms, not elsewhere classified	ICD10 Hierarchy	Condition	CIM10	Valid	Non-standard
37616060	J38	Diseases of vocal cords and larynx, not elsewhere classified	ICD10 Hierarchy	Condition	CIM10	Valid	Non-standard
37616065	M01	Direct infections of joint in infectious and parasitic diseases classified elsewhere	ICD10 Hierarchy	Condition	CIM10	Valid	Non-standard
37616067	M03	Postinfective and reactive arthropathies in diseases classified elsewhere	ICD10 Hierarchy	Condition	CIM10	Valid	Non-standard
37616069	M09	Juvenile arthritis in diseases classified elsewhere	ICD10 Hierarchy	Condition	CIM10	Valid	Non-standard
37616072	K72	Hepatic failure, not elsewhere classified	ICD10 Hierarchy	Condition	CIM10	Valid	Non-standard
37616074	K91	Postprocedural disorders of digestive system, not elsewhere classified	ICD10 Hierarchy	Condition	CIM10	Valid	Non-standard
37616075	K93	Disorders of other digestive organs in diseases classified elsewhere	ICD10 Hierarchy	Condition	CIM10	Valid	Non-standard
37616078	M36	Systemic disorders of connective tissue in diseases classified elsewhere	ICD10 Hierarchy	Condition	CIM10	Valid	Non-standard
37616080	M49	Spondylopathies in diseases classified elsewhere	ICD10 Hierarchy	Condition	CIM10	Valid	Non-standard
37616081	T38	Poisoning by hormones and their synthetic substitutes and antagonists, not elsewhere classified	ICD10 Hierarchy	Condition	CIM10	Valid	Non-standard
37616086	T45	Poisoning by primarily systemic and haematological agents, not elsewhere classified	ICD10 Hierarchy	Condition	CIM10	Valid	Non-standard
37616124	X41	Accidental poisoning by and exposure to antiepileptic, sedative-hypnotic, antiparkinsonism and psychotropic drugs, not elsewhere classified	ICD10 Hierarchy	Condition	CIM10	Valid	Non-standard
37616134	T79	Certain early complications of trauma, not elsewhere classified	ICD10 Hierarchy	Condition	CIM10	Valid	Non-standard
37616136	T81	Complications of procedures, not elsewhere classified	ICD10 Hierarchy	Condition	CIM10	Valid	Non-standard
37616202	E34.2	Ectopic hormone secretion, not elsewhere classified	ICD10 code	Condition	CIM10	Valid	Non-standard
40273805	111251004	Other infections of bone in diseases classified elsewhere	Disorder	Condition	SNOMED	Invalid	Non-standard
40274840	111471006	Perinatal jaundice from causes classified elsewhere	Disorder	Condition	SNOMED	Invalid	Non-standard
40316188	157622001	Burns classified according to percentage of body surface involved	Disorder	Condition	SNOMED	Invalid	Non-standard
40344547	266170002	[X]Other specified bacterial agents as the cause of diseases classified to other chapters	Disorder	Condition	SNOMED	Invalid	Non-standard
40353441	274551003	[X] Hepatomegaly with splenomegaly, not elsewhere classified	Disorder	Condition	SNOMED	Invalid	Non-standard
40353447	274557004	[EDTA] Renal vascular disease - classified associated with renal failure	Disorder	Condition	SNOMED	Invalid	Non-standard
40353555	268046007	[X]Synovial hypertrophy, not elsewhere classified	Disorder	Condition	SNOMED	Invalid	Non-standard
40353595	269754005	[X]Enzymes causing adverse effects in therapeutic use, not elsewhere classified	Disorder	Condition	SNOMED	Invalid	Non-standard
40353844	274576002	[X] Speech disturbances, not elsewhere classified	Disorder	Condition	SNOMED	Invalid	Non-standard
40356741	268725005	[X]Mild mental and behavioral disorders associated with the puerperium, not elsewhere classified	Disorder	Condition	SNOMED	Invalid	Non-standard
40356742	268726006	[X]Severe mental and behavioral disorders associated with the puerperium, not elsewhere classified	Disorder	Condition	SNOMED	Invalid	Non-standard
40376597	186710009	[X]Hiv disease resulting in hematological and immunological abnormalities, not elsewhere classified	Disorder	Condition	SNOMED	Invalid	Non-standard
40376599	186711008	[X]HIV disease resulting in multiple diseases classified elsewhere	Disorder	Condition	SNOMED	Invalid	Non-standard
40377070	186764007	[X]Adenovirus as the cause of diseases classified to other chapters	Disorder	Condition	SNOMED	Invalid	Non-standard
40380223	187428004	[X]Other viral infections characterized by skin and mucocutaneous lesions, not elsewhere classified	Disorder	Condition	SNOMED	Invalid	Non-standard
40380247	187450003	[X]HIV disease resulting in multiple diseases classified elsewhere	Disorder	Condition	SNOMED	Invalid	Non-standard
40380249	187451004	[X]Hiv disease resulting in hematological and immunological abnormalities, not elsewhere classified	Disorder	Condition	SNOMED	Invalid	Non-standard
40380262	187463009	[X]Retrovirus infections, not elsewhere classified	Disorder	Condition	SNOMED	Invalid	Non-standard
40380313	187509009	[X]Other parasitologically confirmed malaria, not elsewhere classified	Disorder	Condition	SNOMED	Invalid	Non-standard
40380806	187567008	[X]Streptococcus, group a, as the cause of diseases classified to other chapters	Disorder	Condition	SNOMED	Invalid	Non-standard
40380807	187568003	[X]Streptococcus, group b, as the cause of diseases classified to other chapters	Disorder	Condition	SNOMED	Invalid	Non-standard
40380808	187569006	[X]Streptococcus, group d, as the cause of diseases classified to other chapters	Disorder	Condition	SNOMED	Invalid	Non-standard
40380809	187570007	[X]Streptococcus pneumoniae as the cause of diseases classified to other chapters	Disorder	Condition	SNOMED	Invalid	Non-standard
40380811	187571006	[X]Other streptococcus as the cause of diseases classified to other chapters	Disorder	Condition	SNOMED	Invalid	Non-standard
40380812	187572004	[X]Unspecified streptococcus as the cause of diseases classified to other chapters	Disorder	Condition	SNOMED	Invalid	Non-standard
40380813	187573009	[X]Staphylococcus aureus as the cause of diseases classified to other chapters	Disorder	Condition	SNOMED	Invalid	Non-standard
40380814	187574003	[X]Other staphylococcus as the cause of diseases classified to other chapters	Disorder	Condition	SNOMED	Invalid	Non-standard
40380815	187575002	[X]Unspecified staphylococcus as the cause of diseases classified to other chapters	Disorder	Condition	SNOMED	Invalid	Non-standard
40380816	187576001	[X]Mycoplasma pneumoniae [pplo] as the cause of diseases classified to other chapters	Disorder	Condition	SNOMED	Invalid	Non-standard
40380817	187577005	[X]Klebsiella pneumoniae as the cause of diseases classified to other chapters	Disorder	Condition	SNOMED	Invalid	Non-standard
40380818	187578000	[X]Escherichia coli [e coli] as the cause of diseases classified to other chapters	Disorder	Condition	SNOMED	Invalid	Non-standard
40380819	187579008	[X]Haemophilus influenzae [h influenzae] as the cause of diseases classified to other chapters	Disorder	Condition	SNOMED	Invalid	Non-standard
40380820	187580006	[X]Proteus (mirabilis)(morganii) as the cause of diseases classified to other chapters	Disorder	Condition	SNOMED	Invalid	Non-standard
40380822	187581005	[X]Pseudomonas as the cause of diseases classified to other chapters	Disorder	Condition	SNOMED	Invalid	Non-standard
40380823	187582003	[X]Bacillus fragilis as the cause of diseases classified to other chapters	Disorder	Condition	SNOMED	Invalid	Non-standard
40380824	187583008	[X]Clostridium perfringens as the cause of diseases classified to other chapters	Disorder	Condition	SNOMED	Invalid	Non-standard
40380825	187584002	[X] Cause of diseases classified to other chapters: [OS bacterial agents] or [coliform bacteria]	Disorder	Condition	SNOMED	Invalid	Non-standard
40380826	187585001	[X]Adenovirus as the cause of diseases classified to other chapters	Disorder	Condition	SNOMED	Invalid	Non-standard
40380827	187586000	[X]Enterovirus as the cause of diseases classified to other chapters	Disorder	Condition	SNOMED	Invalid	Non-standard
40380828	187587009	Coronavirus as the cause of diseases classified to other chapters	Disorder	Condition	SNOMED	Invalid	Non-standard
40380829	187588004	Retrovirus as the cause of diseases classified to other chapters	Disorder	Condition	SNOMED	Invalid	Non-standard
40380830	187589007	Respiratory syncytial virus as the cause of diseases classified to other chapters	Disorder	Condition	SNOMED	Invalid	Non-standard
40380831	187590003	Reovirus as the cause of diseases classified to other chapters	Disorder	Condition	SNOMED	Invalid	Non-standard
40380833	187591004	Parvovirus as the cause of diseases classified to other chapters	Disorder	Condition	SNOMED	Invalid	Non-standard
